workerid,proliferate.condition,age,ethnicity,feedback,gender,race,error
853,Condition 4,29,Non-Hispanic,"I thought everyone had responsibility to look into not just the report, but current research, even if it was not explicitly mentioned in the report. Also, in the scenario about outdoor furniture, you use the word ""vanquish"" - maybe you meant varnish?",Female,White,
846,Condition 4,34,Non-Hispanic,I am an environmentalist and a communist and feel that corporate responsibility is severely lacking in every aspect of daily life,Female,White,
850,Condition 4,60,Non-Hispanic,"I based my decisions on 1. whether the information was available to the CEO and 2. did they know there was another study available and take the time to read it.

Due diligence in making decisions that could harm people, animals or the environment",Female,White,
830,Condition 4,45,Non-Hispanic,I believe that CEOs have a responsibility to make sure that products are safe. They should be doing their research. They also typically are super greedy and only care about profits.,Female,White,
927,Condition 4,20,,"Every CEO still decided to launch their new product, even though they 100% knew it’d be harmful to the environment. Regardless of whether they knew if it’d pollute the environment, they still would have launched the new product. ",Female,Multiracial,
986,Condition 4,25,Non-Hispanic,NA,Male,White,
864,Condition 4,58,,I mostly imagined what I would do as the CEO in each scenario if I were trying to do the right thing.,Female,White,
888,Condition 4,32,Non-Hispanic,I think whether or not they knew the product would have harmful side effects due to any chemicals released affected my decision. If it's unclear then there's a moral gray area.,Male,White,
